Fiil,Edat,Kasus,Türkçe Anlamı,Örnek Cümle
abhängen,von,Dativ,bir şeye bağlı olmak,Das hängt vom Wetter ab.
achten,auf,Akkusativ,bir şeye dikkat etmek,Achte auf den Verkehr!
anfangen,mit,Dativ,bir şeye başlamak,Wir fangen mit dem Spiel an.
sich anpassen,an,Akkusativ,bir şeye uyum sağlamak,Man muss sich an die neuen Regeln anpassen.
antworten,auf,Akkusativ,bir şeye cevap vermek,Er antwortet auf die E-Mail.
sich ärgern,über,Akkusativ,birine/bir şeye kızmak,Ich ärgere mich über den Fehler.
aufhören,mit,Dativ,bir şeye son vermek/bırakmak,Hör mit dem Lärm auf!
aufpassen,auf,Akkusativ,dikkat etmek/göz kulak olmak,Pass auf meine Tasche auf!
sich aufregen,über,Akkusativ,bir şeye heyecanlanmak/sinirlenmek,Reg dich nicht über Kleinigkeiten auf.
ausgeben,für,Akkusativ,bir şey için para harcamak,Er gibt viel Geld für Autos aus.
sich bedanken,bei,Dativ,birine teşekkür etmek,Ich bedanke mich bei dir.
sich bedanken,für,Akkusativ,bir şey için teşekkür etmek,Ich bedanke mich für das Geschenk.
beginnen,mit,Dativ,bir şeye başlamak,Das Konzert beginnt mit einem Klaviersolo.
sich bemühen,um,Akkusativ,bir şey için çabalamak,Er bemüht sich um einen Job.
berichten,über,Akkusativ,bir şey hakkında rapor vermek/anlatmak,Die Zeitung berichtet über den Unfall.
sich beschäftigen,mit,Dativ,bir şeyle meşgul olmak,Ich beschäftige mich mit deutscher Grammatik.
sich beschweren,bei,Dativ,birine şikayet etmek,Er beschwert sich beim Chef.
sich beschweren,über,Akkusativ,bir şeyi şikayet etmek,Wir beschweren uns über das Essen.
bestehen,aus,Dativ,bir şeyden oluşmak,Der Kurs besteht aus 10 Lektionen.
sich bewerben,um,Akkusativ,bir şeye başvurmak,Sie bewirbt sich um die Stelle.
bitten,um,Akkusativ,bir şey rica etmek,Darf ich dich um einen Gefallen bitten?
danken,für,Akkusativ,bir şey için teşekkür etmek,Ich danke dir für deine Hilfe.
denken,an,Akkusativ,birini/bir şeyi düşünmek,Ich denke oft an dich.
diskutieren,mit,Dativ,biriyle tartışmak,Ich diskutiere mit meinem Freund.
diskutieren,über,Akkusativ,bir konu hakkında tartışmak,Wir diskutieren über Politik.
einladen,zu,Dativ,bir şeye davet etmek,Ich lade dich zum Essen ein.
sich entscheiden,für,Akkusativ,bir şey için karar vermek,Wir entscheiden uns für dieses Auto.
sich entschuldigen,bei,Dativ,birinden özür dilemek,Ich entschuldige mich bei dir.
sich entschuldigen,für,Akkusativ,bir şey için özür dilemek,Ich entschuldige mich für die Verspätung.
erfahren,von,Dativ,bir şeyden haberdar olmak,Ich habe von dem Projekt erfahren.
sich erholen,von,Dativ,bir şeyden sonra dinlenmek/iyileşmek,Er muss sich von der Krankheit erholen.
sich erinnern,an,Akkusativ,bir şeyi/birini hatırlamak,Ich erinnere mich an unseren Urlaub.
erkennen,an,Dativ,birinden/bir şeyden tanımak,Ich erkenne ihn an seiner Stimme.
sich erkundigen,nach,Dativ,bir şeyi bilgi almak amacıyla sormak,Ich erkundige mich nach den Preisen.
erschrecken,über,Akkusativ,bir şeye korkmak/ürkmek,Ich erschrecke über das laute Geräusch.
erzählen,von,Dativ,birinden/bir şeyden bahsetmek,Erzähl mir von deiner Reise.
fragen,nach,Dativ,bir şeyi sormak,Der Tourist fragt nach dem Weg.
sich freuen,auf,Akkusativ,gelecekteki bir şeye sevinmek,Ich freue mich auf das Wochenende.
sich freuen,über,Akkusativ,olmuş bir şeye sevinmek,Ich freue mich über dein Geschenk.
gehören,zu,Dativ,birine/bir yere ait olmak,Das gehört zu meinen Aufgaben.
sich gewöhnen,an,Akkusativ,bir şeye alışmak,Ich muss mich an das Klima gewöhnen.
glauben,an,Akkusativ,bir şeye/birine inanmak,Glaubst du an Geister?
gratulieren,zu,Dativ,bir şey için tebrik etmek,Ich gratuliere dir zum Geburtstag.
halten,von,Dativ,bir şey hakkında bir fikre sahip olmak,Was hältst du von dem neuen Film?
hoffen,auf,Akkusativ,bir şeyi ummak,Wir hoffen auf gutes Wetter.
sich informieren,über,Akkusativ,bir şey hakkında bilgi edinmek,Ich informiere mich über den Kurs.
sich interessieren,für,Akkusativ,bir şeyle ilgilenmek,Er interessiert sich für Kunst.
kämpfen,für,Akkusativ,bir şey için savaşmak,Sie kämpfen für die Umwelt.
kämpfen,gegen,Akkusativ,bir şeye karşı savaşmak,Wir kämpfen gegen die Armut.
sich konzentrieren,auf,Akkusativ,bir şeye konsantre olmak,Ich konzentriere mich auf meine Arbeit.
sich kümmern,um,Akkusativ,bir şeyle/biriyle ilgilenmek,Sie kümmert sich um die Kinder.
lachen,über,Akkusativ,bir şeye gülmek,Wir lachen über den Witz.
leiden,an,Dativ,bir hastalıktan muzdarip olmak,Er leidet an einer schweren Krankheit.
leiden,unter,Dativ,bir durumdan muzdarip olmak,Sie leidet unter dem Lärm.
nachdenken,über,Akkusativ,bir şey hakkında düşünmek,Ich muss über deinen Vorschlag nachdenken.
protestieren,gegen,Akkusativ,bir şeyi protesto etmek,Die Studenten protestieren gegen die Gebühren.
rechnen,mit,Dativ,bir hesaba katmak / beklemek,Wir rechnen mit starkem Regen.
reden,über,Akkusativ,bir şey hakkında konuşmak,Wir reden über die Zukunft.
reden,mit,Dativ,biriyle konuşmak,Ich rede mit meinem Kollegen.
riechen,nach,Dativ,bir şey gibi kokmak,Hier riecht es nach Kaffee.
schmecken,nach,Dativ,bir şey gibi tatmak,Das schmeckt nach Schokolade.
schreiben,an,Akkusativ,birine yazmak,Ich schreibe an meinen Freund.
schreiben,über,Akkusativ,bir şey hakkında yazmak,Er schreibt über seine Erfahrungen.
sich schützen,vor,Dativ,bir şeyden korunmak,Die Brille schützt vor der Sonne.
sorgen,für,Akkusativ,bir şeyin bakımını sağlamak,Eltern sorgen für ihre Kinder.
sprechen,mit,Dativ,biriyle konuşmak,Ich spreche mit dem Lehrer.
sprechen,über,Akkusativ,bir şey hakkında konuşmak,Wir sprechen über den Plan.
sterben,an,Dativ,bir şeyden ölmek,Er ist an Krebs gestorben.
sich streiten,mit,Dativ,biriyle tartışmak/kavga etmek,Ich streite mich oft mit meinem Bruder.
sich streiten,über,Akkusativ,bir şey hakkında tartışmak,Wir streiten über das Geld.
teilnehmen,an,Dativ,bir şeye katılmak,Ich nehme an dem Kurs teil.
telefonieren,mit,Dativ,biriyle telefonda görüşmek,Ich telefoniere mit meiner Mutter.
sich treffen,mit,Dativ,biriyle buluşmak,Ich treffe mich mit Freunden.
sich trennen,von,Dativ,birinden ayrılmak,Er hat sich von seiner Frau getrennt.
überreden,zu,Dativ,bir şeye ikna etmek,Ich überrede ihn zum Mitkommen.
sich unterhalten,mit,Dativ,biriyle sohbet etmek,Ich unterhalte mich mit dem Nachbarn.
sich unterhalten,über,Akkusativ,bir şey hakkında sohbet etmek,Wir unterhalten uns über Politik.
sich verabreden,mit,Dativ,biriyle sözleşmek/randevulaşmak,Ich bin mit ihr verabredet.
sich verabschieden,von,Dativ,birinden vedalaşmak,Ich verabschiede mich von euch.
vergleichen,mit,Dativ,bir şeyle karşılaştırmak,Man kann Äpfel nicht mit Birnen vergleichen.
sich verlassen,auf,Akkusativ,birine/bir şeye güvenmek,Ich verlasse mich auf dich.
sich verlieben,in,Akkusativ,birine aşık olmak,Er hat sich in sie verliebt.
sich verstehen,mit,Dativ,biriyle iyi anlaşmak,Ich verstehe mich gut mit ihm.
sich vorbereiten,auf,Akkusativ,bir şeye hazırlanmak,Ich bereite mich auf die Prüfung vor.
warnen,vor,Dativ,bir şeye karşı uyarmak,Ich warne dich vor dem Hund.
warten,auf,Akkusativ,beklemek,Wir warten auf den Bus.
sich wenden,an,Akkusativ,birine başvurmak/danışmak,Bitte wenden Sie sich an die Rezeption.
werden,zu,Dativ,bir şeye dönüşmek,Raupe wird zu einem Schmetterling.
wissen,von,Dativ,birinden/bir şeyden haberi olmak,Ich weiß von nichts.
sich wundern,über,Akkusativ,bir şeye şaşırmak,Ich wundere mich über seine Reaktion.
zuschauen,bei,Dativ,bir şeye izleyici olarak katılmak,Ich schaue ihm beim Spielen zu.
zweifeln,an,Dativ,bir şeyden şüphe etmek,Ich zweifle an seiner Geschichte.
